{
  "contract_id": "signal-head",
  "schema_version": "1.0.0",
  "sequence": 1,
  "run_id": "fixture-run-2026-07-29",
  "signal_id": "fixture-active-2026-07-29",
  "signal_sha256": "ffffffffffffffffffffffffffffffffffffffffffffffffffffffffffffffff",
  "previous_head_sha256": null,
  "as_of": "2026-07-29",
  "generated_at": "2026-07-29T08:10:00Z"
}
